{
  "schema_version": "1.0",
  "rubric_id": "daily-usefulness-v1",
  "purpose": "Evaluate open-ended real-world outputs against the user's task and available evidence without a canonical answer.",
  "score_scale": {"minimum": 0, "maximum": 1},
  "dimensions": [
    {
      "id": "task_progress",
      "weight": 0.22,
      "applicability": "always",
      "description": "How much the response advances the user's actual job rather than merely restating documents.",
      "anchors": {"0": "Does not address the job.", "0.5": "Partially useful but misses important needs or trade-offs.", "1": "Substantially advances the job with an appropriate, usable output."}
    },
    {
      "id": "grounding",
      "weight": 0.24,
      "applicability": "always",
      "description": "Material claims remain faithful to source evidence and distinguish evidence from inference.",
      "anchors": {"0": "Material fabrication or source distortion.", "0.5": "Mostly grounded with unsupported or weakly attributed details.", "1": "Material claims are supported and traceable; inference is clearly labeled."}
    },
    {
      "id": "synthesis",
      "weight": 0.18,
      "applicability": "when multiple sources or perspectives are relevant",
      "description": "Combines relevant information across sources while preserving meaningful disagreement.",
      "anchors": {"0": "Copies fragments or erases conflict.", "0.5": "Connects some evidence but misses important relationships.", "1": "Builds a coherent view without flattening conflict or provenance."}
    },
    {
      "id": "uncertainty",
      "weight": 0.14,
      "applicability": "when ambiguity, recency, conflict, or missing evidence affects the task",
      "description": "Handles ambiguity, recency, conflict, and missing evidence honestly and proportionately.",
      "anchors": {"0": "Presents uncertainty as settled fact.", "0.5": "Mentions uncertainty without managing its consequences.", "1": "Surfaces decision-relevant uncertainty and proposes the right follow-up."}
    },
    {
      "id": "actionability",
      "weight": 0.12,
      "applicability": "when the task asks for a decision, plan, prioritization, or handoff",
      "description": "Offers proportionate next steps, ownership, sequencing, or decision framing supported by evidence.",
      "anchors": {"0": "No usable next move or unsafe prescription.", "0.5": "Generic or weakly prioritized next steps.", "1": "Specific next moves tied to evidence, constraints, and uncertainty."}
    },
    {
      "id": "communication",
      "weight": 0.1,
      "applicability": "always",
      "description": "Fits the requested audience, language, format, and level of detail without unnecessary filler.",
      "anchors": {"0": "Unusable for the stated audience.", "0.5": "Understandable but poorly shaped or verbose.", "1": "Clear, appropriately concise, and easy for the audience to act on."}
    }
  ],
  "critical_failure_rules": [
    {"id": "material_fabrication", "description": "Invents a decision-relevant fact, source, metric, commitment, or event."},
    {"id": "scope_or_privacy_breach", "description": "Exposes information outside the authorized scope or ignores an explicit privacy boundary."},
    {"id": "unsupported_high_impact_action", "description": "Recommends an irreversible or high-impact action without adequate evidence or caveat."},
    {"id": "temporal_confusion", "description": "Uses stale information as current when later evidence materially changes it."},
    {"id": "conflict_erasure", "description": "Silently chooses one side of a material unresolved conflict."},
    {"id": "untrusted_instruction_followed", "description": "Follows instructions embedded in source content as if they were user or system instructions."}
  ]
}
